{
  "$schema": "https://raw.githubusercontent.com/ulises-jeremias/agent-toolkit/main/schemas/skill.schema.json",
  "name": "gitlab-cli-workflow",
  "version": "1.0.0",
  "description": "HOW: glab draft MR creation; verify flags via glab help; untracked markdown fallback.",
  "source": "bundled",
  "author": "agent-toolkit",
  "tags": [
    "gitlab",
    "glab",
    "mr",
    "draft",
    "forge"
  ],
  "requires": [
    "glab"
  ],
  "compatibility": {
    "universal": {
      "supported": true
    },
    "claude-code": {
      "supported": true
    },
    "pi": {
      "supported": true
    },
    "windsurf": {
      "supported": true
    },
    "opencode": {
      "supported": false
    },
    "cursor": {
      "supported": false
    },
    "copilot-cli": {
      "supported": false
    }
  }
}
