{
  "$schema": "https://raw.githubusercontent.com/ulises-jeremias/agent-toolkit/main/lib/schemas/skill.schema.json",
  "name": "workflow-client-bootstrap",
  "version": "1.0.0",
  "description": "WHAT: Interactive interview that stores client delivery context into the user's workspace as packs + knowledge (no client skills).",
  "source": "bundled",
  "author": "agent-toolkit",
  "tags": [
    "agent-toolkit",
    "workflow",
    "bootstrap",
    "client",
    "onboarding",
    "delivery"
  ],
  "compatibility": {
    "universal": {
      "supported": true
    },
    "claude-code": {
      "supported": true
    },
    "pi": {
      "supported": true
    },
    "windsurf": {
      "supported": true
    },
    "opencode": {
      "supported": false
    },
    "cursor": {
      "supported": false
    },
    "copilot-cli": {
      "supported": false
    }
  }
}
