{
  "$schema": "https://raw.githubusercontent.com/ulises-jeremias/agent-toolkit/main/lib/schemas/skill.schema.json",
  "name": "spike",
  "version": "1.0.0",
  "description": "WHAT: Produce spike and research findings using the agent-toolkit spike template; captures purpose, findings, implementation strategy, risks, tradeoffs, open questions, and references.",
  "source": "bundled",
  "author": "agent-toolkit",
  "tags": [
    "agent-toolkit",
    "spike",
    "research",
    "architecture",
    "tradeoffs"
  ],
  "compatibility": {
    "universal": {
      "supported": true
    },
    "claude-code": {
      "supported": true
    },
    "pi": {
      "supported": true
    },
    "windsurf": {
      "supported": true
    },
    "opencode": {
      "supported": false
    },
    "cursor": {
      "supported": false
    },
    "copilot-cli": {
      "supported": false
    }
  }
}
