{
  "$schema": "https://raw.githubusercontent.com/ulises-jeremias/agent-toolkit/main/lib/schemas/skill.schema.json",
  "name": "onboarding",
  "version": "1.0.0",
  "description": "WHAT: Getting started guide for new users \u2014 setup validation, skill/agent hierarchy, first commands by role (developer, PM, tech lead).",
  "source": "bundled",
  "author": "agent-toolkit",
  "tags": [
    "onboarding",
    "setup",
    "getting-started"
  ],
  "compatibility": {
    "universal": {
      "supported": true
    },
    "claude-code": {
      "supported": true
    },
    "pi": {
      "supported": true
    },
    "windsurf": {
      "supported": true
    },
    "opencode": {
      "supported": true
    },
    "cursor": {
      "supported": true
    },
    "copilot-cli": {
      "supported": true
    }
  }
}
