{
  "$schema": "https://raw.githubusercontent.com/ulises-jeremias/agent-toolkit/main/schemas/skill.schema.json",
  "name": "gh-contribution-planner",
  "version": "1.0.0",
  "description": "Daily GitHub contribution planner — analyzes the gh-logged-in user's non-archived repos (forks + sources) and recent contributions, produces a prioritized plan, then dispatches parallel sub-agents to execute approved items via existing PR/CI/review skills.",
  "source": "bundled",
  "author": "agent-toolkit",
  "tags": [
    "github",
    "planner",
    "contributions",
    "maintenance",
    "open-source",
    "pull-request",
    "forks"
  ],
  "requires": [
    "gh",
    "python3"
  ],
  "compatibility": {
    "claude-code": {
      "supported": true
    },
    "cursor": {
      "supported": true
    },
    "opencode": {
      "supported": true
    },
    "windsurf": {
      "supported": true
    },
    "pi": {
      "supported": true
    },
    "copilot-cli": {
      "supported": true,
      "notes": "Parallel sub-agent dispatch falls back to sequential execution when the host lacks a Task-like primitive."
    },
    "universal": {
      "supported": false
    }
  }
}
