{
  "$schema": "https://raw.githubusercontent.com/ulises-jeremias/agent-toolkit/main/lib/schemas/skill.schema.json",
  "name": "output-handshake",
  "version": "1.0.0",
  "description": "WHAT: Ask where the final artifact goes and confirm human review before writing PRD/TRD/ADR/PR bodies; never assume a single default location.",
  "source": "bundled",
  "author": "agent-toolkit",
  "tags": [
    "agent-toolkit",
    "governance",
    "artifacts",
    "handshake",
    "review"
  ],
  "compatibility": {
    "universal": {
      "supported": true
    },
    "claude-code": {
      "supported": true
    },
    "pi": {
      "supported": true
    },
    "windsurf": {
      "supported": true
    },
    "opencode": {
      "supported": false
    },
    "cursor": {
      "supported": false
    },
    "copilot-cli": {
      "supported": false
    }
  }
}
