{
  "$schema": "https://raw.githubusercontent.com/ulises-jeremias/agent-toolkit/main/schemas/skill.schema.json",
  "name": "snowflake-validation",
  "version": "1.0.0",
  "description": "HOW: read-only Snowflake checks per repo; explicit skip when creds missing; no false success claims.",
  "source": "bundled",
  "author": "agent-toolkit",
  "tags": [
    "snowflake",
    "data",
    "validation",
    "sql"
  ],
  "compatibility": {
    "universal": {
      "supported": true
    },
    "claude-code": {
      "supported": true
    },
    "pi": {
      "supported": true
    },
    "windsurf": {
      "supported": true
    },
    "opencode": {
      "supported": false
    },
    "cursor": {
      "supported": false
    },
    "copilot-cli": {
      "supported": false
    }
  }
}
