{
  "$schema": "https://raw.githubusercontent.com/ulises-jeremias/agent-toolkit/main/lib/schemas/skill.schema.json",
  "name": "llm-cost-advisor",
  "version": "1.0.0",
  "description": "WHAT: Recommend the most cost-effective LLM provider per task type; show per-provider cost estimates; remind about budget gate configuration.",
  "source": "bundled",
  "author": "agent-toolkit",
  "tags": [
    "llm",
    "cost",
    "provider",
    "optimization"
  ],
  "compatibility": {
    "universal": {
      "supported": true
    },
    "claude-code": {
      "supported": true
    },
    "pi": {
      "supported": true
    },
    "windsurf": {
      "supported": true
    },
    "opencode": {
      "supported": true
    },
    "cursor": {
      "supported": true
    },
    "copilot-cli": {
      "supported": true
    }
  }
}
