{
  "$schema": "https://raw.githubusercontent.com/ulises-jeremias/agent-toolkit/main/lib/schemas/skill.schema.json",
  "name": "adr",
  "version": "1.0.0",
  "description": "WHAT: Architecture Decision Records per the agent-toolkit ADR workflow in ClickUp: when to write, structure, review, and traceability; delegates forge steps to GitHub/GitLab skills.",
  "source": "bundled",
  "author": "agent-toolkit",
  "tags": [
    "agent-toolkit",
    "adr",
    "architecture",
    "decisions",
    "clickup",
    "governance"
  ],
  "compatibility": {
    "universal": {
      "supported": true
    },
    "claude-code": {
      "supported": true
    },
    "pi": {
      "supported": true
    },
    "windsurf": {
      "supported": true
    },
    "opencode": {
      "supported": false
    },
    "cursor": {
      "supported": false
    },
    "copilot-cli": {
      "supported": false
    }
  }
}
