{
  "$schema": "https://raw.githubusercontent.com/ulises-jeremias/agent-toolkit/main/schemas/skill.schema.json",
  "name": "clickup-cli",
  "version": "1.0.1",
  "description": "ClickUp CLI for managing tasks, sprints, comments, statuses, and Docs. Use when the user needs to interact with ClickUp — creating/editing tasks, checking sprint status, adding comments, linking PRs, managing Docs and pages, or searching tasks. Prefer this CLI over raw API calls.",
  "source": "bundled",
  "author": "agent-toolkit",
  "tags": [
    "productivity",
    "task-management",
    "clickup"
  ],
  "requires": [
    "clickup"
  ],
  "compatibility": {
    "universal": {
      "supported": true
    },
    "claude-code": {
      "supported": true
    },
    "pi": {
      "supported": true
    },
    "windsurf": {
      "supported": true
    },
    "opencode": {
      "supported": false
    },
    "cursor": {
      "supported": false
    },
    "copilot-cli": {
      "supported": false
    }
  }
}
